[
  {
    "date": "2025-10-20",
    "title": "Pamba River Clean-up Sprint",
    "where": "SNDP Hall, Chathenkery",
    "note": "Morning riverbank sweep with flood-safety drill"
  },
  {
    "date": "2025-11-08",
    "title": "Pilgrim Transit Desk Training",
    "where": "Chengannur Mahadevar Temple Transit Hub",
    "note": "Briefing for Sabarimala season volunteers"
  },
  {
    "date": "2025-12-05",
    "title": "Scholarship Mentoring Marathon",
    "where": "Community Study Centre, Chathenkery",
    "note": "Career guidance & digital literacy pods"
  }
]
